,Name,Price,Link,Description
0,New Saridon Tablet for Fast Headache Relief,₹47,https://www.1mg.com/otc/new-saridon-tablet-for-fast-headache-relief-otc123063,"New Saridon Tablet Headache ReliefNew Saridon is a remedy for headaches trusted since 1934. Just one tablet of New Saridon is enough to provide relief from headaches. It is effective for different headache types of headaches spread across, on the sides and back of the head.Key Ingredients:Paracetamol IP 500 mg, Caffeine (anhydrous) IP 50 mgKey Benefits:Unique triple-action formula for quick headache reliefRelief with just one tabletIndia's No. 1 headache specialistTrusted since 1934Easy to carry and store in a first aid boxDirections For Use:1 tablet every 4- 6 hours with a minimum gap of 4 hours and not more than 6 tablets per 24 hoursSafety Information:Taking more than a daily dose may cause liver damage or allergic reaction such as swelling of the face, itchy throat, rash or difficulty in breathingNot meant for pregnant/lactating women, children or adults undergoing treatment without a doctor's consultationNot to be consumed with other paracetamol-containing medicines or if allergic to any of the ingredientsDo not use it for more than 5 days continuously. In case of excess pain, visit a physician. If consuming New Saridon, limit the intake of caffeine such as coffee etc. on that dayNew Saridon must not be used by children under 12 years of ageCaution should be exercised when taking New Saridon for existing medical conditions like liver, kidney, asthma, chronic rhinitis, chronic urticariaBest to consult your doctor before consuming New Saridon in the above scenarioIn case of use of other analgesics containing/ not containing Paracetamol in addition to New Saridon, pls consult your dr before using the sameFrequently Asked Questions:Q. What is New Saridon Tablet used for?New Saridon is an effective remedy for headaches. Just one tablet of New Saridon is enough to provide relief from various types of headaches. It is effective for different headache types of headache such as a headache that spreads across, on the sides and back of the head.Q. How long does Paracetamol take to work?Paracetamol takes around 30-45 minutes to start working, following which you may notice a decrease in your body temperature and relief in pain.Q. When will I feel better after taking Paracetamol?Usually, you will start feeling better after about half an hour of taking this medicine. However, it is advised to complete the course of your medicine to attain its maximum benefits.Q. How often can I take Paracetamol?You should only take four doses of Paracetamol in 24 hours. There should be a gap of at least 4 hours between two doses. Do not take Paracetamol for more than 3 days without first talking to your doctor.Q. Is Paracetamol safe for children?Paracetamol is considered safe for children only when used as directed by the doctor. New Saridon tablets are considered to be safe in children above 12 years of age. Children below 12 years of age are not advised to take this medicine.Q. What are the serious side effects of taking excess Paracetamol?Taking more than a daily dose may cause liver damage or allergic reaction such as swelling of the face, itchy throat, rash, or difficulty in breathing."
1,Tata 1mg Digital Thermometer with One Touch Operation for Child and Adult,₹94,https://www.1mg.com/otc/tata-1mg-digital-thermometer-with-one-touch-operation-for-child-and-adult-otc842569,"Tata 1mg Digital Thermometer is fast, accurate, and easy to use, which gives a reading within 20 seconds. It can be used in the oral cavity, rectal cavity, or under the armpit. It has a rigid tip and is also water-resistant.Uses:Tata 1mg Digital Thermometer is used to measure the body temperature and convert the reading into a readable format such as Celsius, Fahrenheit or Kelvin.Product Specifications and Features:

Measurement range: 35.5C - 42.0C / 95F - 109F


Error: +/- 0.1C


Accuracy: Highly accurate with memory function


Quick result: Provides reading within 30-40 seconds


Alarm: Notifies when measurement taking is completed


This is a water-resistant thermometer

Good to Know: Dual mode reading (°F and °C )Type of Thermometer: Non-mercury-based digital thermometerDirections for Use:

Clean the tip with cold water and soap, then rinse it


Turn the thermometer on


Put the tip under the tongue, towards the back of the mouth


Close your lips around the thermometer


Wait until it beeps or flashes


Check the temperature on the display

Safety Information:

Read the label carefully before use


Keep the thermometer away from direct contact with sunlight


The thermometer should be washed before and after each use, preferably with an antiseptic solution


Do not wash the thermometer with hot water


Handle the thermometer with care

Frequently Asked Questions:Q. How do you know if the thermometer is accurate?The ice bath test is the easiest way to test a thermometer for accuracy, assuming your thermometer will display temperatures of 32°F or less.Q. How do you know if the thermometer is broken?Insert your thermometer into the glass of cold water without touching the sides of the glass. After 30 seconds, your thermometer should read 32° F. If it doesn't, it may need to be replaced or recalibrated.Q. How do you clean a thermometer?Use a cotton swab dipped in alcohol to clean the inside of any small crevices. Allow the alcohol to air-dry on the thermometer to kill germs effectively.Q. What can affect a thermometer reading?Direct sunlight, cold temperatures or a sweaty forehead can affect temperature readings. Variations in user technique, such as holding the scanner too far away from the forehead, also may affect accuracy."
2,Saridon Advance Tablet for 5 in 1 Pain Relief,₹46,https://www.1mg.com/otc/saridon-advance-tablet-for-5-in-1-pain-relief-otc638057,"Saridon Advance Tablet for 5 in 1 Pain Relief is a 5-in-1 pain relief formula. It relieves severe headaches, neck pain, back pain, toothache, and flu-like symptoms. It seems effective in the conditions of severe headaches, migraine, pain in the left or right side of the head, dental pain, and wisdom tooth pain. It is beneficial to deal with muscle soreness, body stiffness, weakness, body cramps, or whole-body pain. It starts action within 5 minutes and gives quick pain relief.Key Ingredients:Paracetamol IP 650 mgKey Benefits:It is a 5-in-1 effective relief from severe headaches, neck pain, back pain, toothache, and flu-like symptomsSaridon advance severe headache relief tablet provides comfort from multiple types of pain, such as wisdom tooth pain, muscle sore, body stiffness, whole body pain associated with fever, and other sortsThis tablet is relatively easy to swallowIt provides quick action and starts action just within 5 minutesDirections for Use:Take one tablet every 4 to 6 hours without exceeding six tablets a day.Safety Information:Read the label carefullyNot for children below the age of 12Do not exceed the recommended dosageIf pregnant or nursing, consult with the doctor first before using"
3,Dolo 650 Tablet,₹29,https://www.1mg.com/drugs/dolo-650-tablet-74467,"Saridon Advance Tablet for 5 in 1 Pain Relief is a 5-in-1 pain relief formula. It relieves severe headaches, neck pain, back pain, toothache, and flu-like symptoms. It seems effective in the conditions of severe headaches, migraine, pain in the left or right side of the head, dental pain, and wisdom tooth pain. It is beneficial to deal with muscle soreness, body stiffness, weakness, body cramps, or whole-body pain. It starts action within 5 minutes and gives quick pain relief.Key Ingredients:Paracetamol IP 650 mgKey Benefits:It is a 5-in-1 effective relief from severe headaches, neck pain, back pain, toothache, and flu-like symptomsSaridon advance severe headache relief tablet provides comfort from multiple types of pain, such as wisdom tooth pain, muscle sore, body stiffness, whole body pain associated with fever, and other sortsThis tablet is relatively easy to swallowIt provides quick action and starts action just within 5 minutesDirections for Use:Take one tablet every 4 to 6 hours without exceeding six tablets a day.Safety Information:Read the label carefullyNot for children below the age of 12Do not exceed the recommended dosageIf pregnant or nursing, consult with the doctor first before using"
4,Amrutanjan Headache Non-Greasy Roll-On,₹65,https://www.1mg.com/otc/amrutanjan-headache-non-greasy-roll-on-otc540672,"Amrutanjan Headache Roll-On is a non-greasy on-the-go ayurvedic medicine to relieve and alleviate headaches. Headache roll-on works excellent for occasional aches, pains, sprains and headaches. When rolled onto the skin, it provides a delightful heating sensation and relief. Key IngredientsPudina flowerGandhapura oilKapoor powderLavang oilKatuvira satvaIndications It is indicated in headaches.Product Form:Roll on.Key Benefits:Amrutanjan roll-on for headache pain relief features accessible roll-on technology for easy applicationThe ingredients in this formula are non-greasy and won't leave any stains or residues on the skin while providing pain reliefBecause of its portable size, this roll-on can be carried anywhere easily and is readily available when you require instant pain reliefWith a refreshing aroma, this pain roll-on is highly convenient to use by giving a strong cooling action on the skinDosageGently apply on the forehead and repeat 4-5 times a daySuitable for adults and children above five yearsSafety Information For external use onlyRead the label carefully before useStore in a cool and dry place, away from sunlightKeep out of reach of children"
5,Tata 1mg Tejasya Pain Relief Balm,₹95,https://www.1mg.com/otc/tata-1mg-tejasya-pain-relief-balm-otc870108," Tata 1mg Tejasya Pain Relief Balm for muscle and joint pain relief Tata 1mg Tejasya Pain Relief Balm brings the goodness of ayurvedic traditional therapy. It contains gandhpura oil which is known for its anti-inflammatory properties and acts as a strong pain-relieving agent. It is useful in arthritis and relieves joint stiffness and muscular pain. It also contains kapoor provides cooling effect and thus helps in muscle relaxation.Key Ingredients: Mentha Piperita (Pudina), Gaultheria Fragrantissima (Gandhapura Oil), Cinnamomum Camphora (Kapoor)Indication:Remedy for muscle pain, joint pain, shoulder, back pain and headacheKey Benefits: Relaxes muscles and relieves pain Effective pain relief for bone, joint, back, and shoulder painEffective in headache and cough congestionEnriched with pudina satva, gandhapura oil, and kapoorDirections For Use:Wash your hands and apply balm in the affected areaRub gently and thoroughlyWash your hands after applicationDo not apply on irritated/broken skinSafety Information:Read the label carefully before useKeep it away from the reach of childrenStore at room temperatureFor external use only"
6,"Volini Pain Relief Gel for Sprain, Muscle, Joint, Neck & Low Back Pain",₹212,https://www.1mg.com/otc/volini-pain-relief-gel-for-sprain-muscle-joint-neck-low-back-pain-otc138818,"Volini Pain Relief GelGet quick relief from body pain with the Volini spray. The spray can offer quick relief from pain in the muscles and joints. It can work wonders on sprains. Volini may work on the muscles and bones by effectively penetrating and acting upon the problematic area. It is a scientifically produced formula that might work well on the knee, joint, shoulders, back, and neck pains. The tiny particles of the spray infiltrate the skin and stop the pain in the affected area. Volini is highly effective in the case of sports injuries as well, be it muscle pulls, slight strains, or even sprains.Key Ingredients:Diclofenac Diethylamine Equivalent to Diclofenac Sodium 1% w/wMethyl Salicylate IPMenthol IPVirgin Linseed Oil BPPreservativeBenzyl Alcohol IPGel BaseKey Benefits:The spray can offer relief when in painIt is effective for pain in the joints, knees, back, shoulders, and neckIt can work great on sports injuries such as muscle pulls, sprains, and strainIt provides instant and long-lasting pain relief from knee pain, joint pain, back pain, calf pain, and neck painDirections For Use:The Volini pain relief bottle should be shaken well before sprayingHold the spray bottle at a 5cm distance from the affected area and sprayYou can use the spray about three to four times daily or as recommened by your physicianSafety Information:Read the label carefully before useStore in a cool and dry place, away from sunlightKeep out of reach of childrenThe Volini pain relief spray is meant for external application onlyUse Volini per the doctor’s guidance, and be careful not to use more than the given dosageDo not use the spray on open wounds or surfaces of the skin that are rupturedThe spray should not be ingested or come in contact with the eyes and mucous membranesAvoid using the spray near a naked flameDo not burn or make a hole in the bottle even after the spray is over"
7,"Zandu Ultra Power Balm | Relieves Strong Headache, Bodyache & Cold",₹50,https://www.1mg.com/otc/zandu-ultra-power-balm-relieves-strong-headache-bodyache-cold-otc302046,"Zandu Balm Ultra Power is an excellent pain relieving ointment mainly used to alleviate headaches and migraines. With its special formulation it can also offer relief from joint pain and cold as well. It is enhanced version of the normal Zandu balm and is also used for other types of musculo-skeletal pains.Key Ingredients:MentholOil of GaultheriaCajuput OilClove OilCapsaicin Extract. Key Benefits Of Zandu Balm Ultra Power:Menthol penetrates the skin to go deep into the musclesOil of Gaultheria, Clove oil and Cajuput oil are mild analgesicsCapsaicin is a counter irritant which stimulates the nerves in the spinal cord to decrease the intensity of pain signals in the bodyIt also provides fast & long lasting relief from strong headache, backache, knee and joint pain Directions of use: Use it directly on affected area in intervals for 2-3 times a day and massage gently. Safety Information:Use under medical supervisionRead the label carefully before useKeep out of reach of childrenAbout The Brand:Zandu balm is India's leading pain relieving ointment brand that has become synonymous to headaches, body aches and cold remedy. It has been serving its customers for over a century and has developed many different products to deal with growing demands of the people.Quick Tips For Zandu Balm:Wrap the affected part with a crepe bandage or a piece of cloth after applying the balm to preserve the heat and have enhanced effect on the inflamed muscles.FAQs:Q. What is Zandu Balm used for?It is used to relieve various musculo-skeletal pain and headaches. It can also be applied to sprained joints.Q. Can zandu balm be used for pimples?While it may not be necessarily harmful for the skin, it can potentially cause more acne. Its thick and greasy formulation can clog pores to promote acne growth.Q. Are there any side effects of Zandu balm ultra power?While there are no known side effects and Zandu balm, if there are any complications, redness or allergic reactions stop the use immediately and consult the doctor."
8,"Iodex Balm |  For Headache, Sprains, Neck, Shoulder, Joints, Back & Muscular Pain",₹167,https://www.1mg.com/otc/iodex-balm-for-headache-sprains-neck-shoulder-joints-back-muscular-pain-otc370706,"Iodex Balm is a power-packed formula of 5 natural ingredients that helps provide soothing and effective relief from different types of body pains. Iodex balm is a trusted name in Indian households with more than 100 years of expertise in relieving different types of body pain. The balm starts to work in just 4 minutes. It relieves aches and pains of muscles and joints associated with one or more of the following: simple backache, pain in the muscles and joints of the lower back, strains and sprains (involving muscles, tendons, and/or ligaments) and arthritis. Iodex multipurpose balms have natural ingredients.Key Ingredients:Wintergreen oil (Gandapura tel) 20%Turpine ka tel 4%Pudina ka Phool (Peppermint Satva) 3%Nilgiri tel (Eucalyptus oil) 4%Clove oil (Lavang ka tel) 0.10%Ointment baseKey Benefits:Iodex balm is a power-packed formula with 5 natural ingredients that get to work in 4 minutes and provide long-lasting relief from body pains and achesMade up of natural ingredients, this balm has been a trusted name in Indian households for its expertise in relieving pain in joints and musclesIodex helps provide effective relief from different types of musculoskeletal pains like neck/shoulder pain, back pain, joint pain, sprain, strains and arthritisThe Ayurvedic balm provides a warming effect upon massaging that reduces inflammation and provides reliefConcerns It Can Help With: Pain reliefProduct Form: BalmDirections For Use:Rub on the affected area till it is absorbed in the skin and cover itSafety Information:Store in a cool and dry place away from direct sunlightKeep away from childrenDo not use if the seal is damaged or missingRead the label carefully before use"
9,"Zandu Balm | Effective Relief from Cold, Headache & Body Ache",₹44,https://www.1mg.com/otc/zandu-balm-effective-relief-from-cold-headache-body-ache-otc324474,"Zandu Balm is a pain-relief balm that can help provide relief from headaches, body aches, and colds. It provides instant and long-lasting relief from body pains of all kinds. The balm is non-greasy and penetrates swiftly into the affected areas. The analgesic properties help relieve the pain effectively. It is powered by ayurvedic ingredients like menthasatva, and eucalyptus helps reduce different kinds of topical pains. Gaultheria oil acts as a counter-irritant to relieve muscle pain. Mentha present in the balm enhances the cooling effect and helps to soothe the affected area.Key Ingredients:MenthaGaultheriaEucalyptusTrachyspermum ammiBase Q. SIndications:This is indicated in cases of headache, cold, and backache.Product Form: Solid balmKey Benefits:Headache: Helps provide relief from headaches effectivelyCold: May aid in relieving cough and coldBackache: Helps relieve lower backacheDirections For Use:Massage gently on the affected area.Safety Information:Read the label carefully before useStore in a cool and dry place away from direct sunlightKeep out of reach of the children"
10,"Sensur Ayurvedic Fast Pain Relief Oil Roll On | For Headache, Cold, Nasal Congestion, Neck, Body & Joint Pain Relief",₹120,https://www.1mg.com/otc/sensur-ayurvedic-fast-pain-relief-oil-roll-on-for-headache-cold-nasal-congestion-neck-body-joint-pain-relief-otc133273,"Sensur Oil Roll On is a proprietary ayurvedic formulation, a roll on that acts as a natural pain reliever in case of headache, cold, neck and joint pains, nasal congestion.Key Ingredients:Peppermint Oil (Mentha arvensis) PL.SatvaCamphor (Karpura) (Cinnamomum Camphora) Wintergreen Oil (Gandhapura Oil)Usatva Gandhapura (Geutheria Fragrantissima) L. TalaEucalyptus Oil (Nilgiri) L. TalaInert base Flavour Key Benefits:Ayurvedic natural pain relief medicineProvides rapid relief from headache, nasal congestion, cold, sinusitis, and rhinitisRoll-on for easy application and convenient to useEasy to carry and has an energizing aromaDirections For Use:Apply Sensur Roll-On on the affected areaRevolve roll on in a circular motionCover the areaApply it 2 or 3 times a daySafety Information:Read the label carefully before useKeep out of reach of the childrenStore in a cool dry placeFor topical application onlyAvoid contact with eyes & open wounds"
11,"Iodex Balm |  For Headache, Sprains, Neck, Shoulder, Joints, Back & Muscular Pain",₹88,https://www.1mg.com/otc/iodex-balm-for-headache-sprains-neck-shoulder-joints-back-muscular-pain-otc328583,"Iodex Balm is a power-packed formula of 5 natural ingredients that helps provide soothing and effective relief from different types of body pains. Iodex balm is a trusted name in Indian households with more than 100 years of expertise in relieving different types of body pain. The balm starts to work in just 4 minutes. It relieves aches and pains of muscles and joints associated with one or more of the following: simple backache, pain in the muscles and joints of the lower back, strains and sprains (involving muscles, tendons, and/or ligaments) and arthritis. Iodex multipurpose balms have natural ingredients.Key Ingredients:Wintergreen oil (Gandapura tel) 20%Turpine ka tel 4%Pudina ka Phool (Peppermint Satva) 3%Nilgiri tel (Eucalyptus oil) 4%Clove oil (Lavang ka tel) 0.10%Ointment baseKey Benefits:Iodex balm is a power-packed formula with 5 natural ingredients that get to work in 4 minutes and provide long-lasting relief from body pains and achesMade up of natural ingredients, this balm has been a trusted name in Indian households for its expertise in relieving pain in joints and musclesIodex helps provide effective relief from different types of musculoskeletal pains like neck/shoulder pain, back pain, joint pain, sprain, strains and arthritisThe Ayurvedic balm provides a warming effect upon massaging that reduces inflammation and provides reliefConcerns It Can Help With: Pain reliefProduct Form: BalmDirections For Use:Rub on the affected area till it is absorbed in the skin and cover itSafety Information:Store in a cool and dry place away from direct sunlightKeep away from childrenDo not use if the seal is damaged or missingRead the label carefully before use"
12,"Kayam Churna | Eases Constipation, Headache & Hyperacidity",₹170,https://www.1mg.com/otc/kayam-churna-eases-constipation-headache-hyperacidity-otc598364,"Kayam Churna is an ayurvedic preparation that provides relief from constipation, acidity, headache, burning sensation of the eyes, soles of the feet or hands, skin ailments, burning in the chest, and nausea. It helps stay fresh and healthy throughout the day.Key Ingredients:Senna LeavesBlack SaltNishothHimejiSvarjika KsharaJethi MadhIndications:ConstipationAcidityHeadacheBurning sensation in the eyes, feet, or handsSkin ailmentsBurning sensation in the chestNauseaNet Quantity: 100 gmProduct Form: PowderKey Benefits:The powder can help alleviate constipation and indigestionIt helps reduce acidity and burning sensation in the chestIt aids in improving the digestion processIt can be beneficial for skin ailments and nauseaDosage:½ to 1 teaspoon as per requirement at bedtimeIndividual results may vary and dose may be adjusted accordinglySafety Information:Read the label carefully before useStore in a cool and dry placeKeep out of reach of childrenThis product is not recommended during pregnancy"
